channel_id,channel_title,channel_description,is_official
UCZz0CoD-hl43unqqTFOoAIg,Florida travel vlogs,Come see Florida like a true Florida native. I drive around all over florida to show you what each town looks like especially the ...,no
UCe1IA5kmY578O_Qo7Skr-TQ,Long Island Audit,Constitutional Activist Investigative Journalist Exercising Constitutional Rights in a respectful manner. We The People will NOT ...,no
UCmfGxY56Ktpa2UA1DzLhbLg,gatorpics09,"dash cameras, driving, travel, interstates, europe, and asia.",no
UCkNB_lQah9MLniBLlk97iBw,Cam Wilder,i entertain... you laugh Instagram / Twitter: camwilderr bookings: cam@longhaulmgmt.com.,no
UCBNnILlexKYtJu-EGUvq_iA,CboysTV,New videos every Thursday! Check out our merchandise at: www.cboystv.com Follow us on Instagram @cboystv and you can find ...,no
UCVTs_w9Vyi3MUbPMiUHXOUw,Granite City,,no
UCIlNvyhkJlDHDOkg904cJYw,Ra’veion 3K Hargrove,Athlete Photographer IG: Shots.by.3k Twitter: Iam_ray22 Trotwood Madison High school Bowling Green State University Garden ...,no
UCe1IA5kmY578O_Qo7Skr-TQ,Long Island Audit,Constitutional Activist Investigative Journalist Exercising Constitutional Rights in a respectful manner. We The People will NOT ...,no
UCOIkT9bq-1N2BvrsBjhNlag,Virtual Railfan,"Official channel of Virtual Railfan, Inc. Virtual Railfan is the premiere provider for live train cams all over the United States ...",yes
UCCvp8YFh69LMsLSZODmTeRA,Rocktop Academy,Rocktop Academy is a prep school on the forefront of basketball instruction and exposure. The goal at Rocktop is simple; to help ...,no
