channel_id,channel_title,channel_description,is_official
UCHxHJQCYf067_qYAmq9lKcw,City of Boynton Beach,,"the prompt seems to be incomplete as the description is missing. if you provide the full description, i can assist you in determining whether the youtube channel belongs to the official town or city."
UCNEaO45xvNW2koM3D_xs28g,BBPCMC,,no
UCc2j0JhnR8Hx0Hj13RhCJag,City of Delray Beach,Delray Beach is a vibrant city with historic charm and award-winning beaches. www.delraybeachfl.gov.,yes
UCu_oA1jxD2r9db8ME61eLEQ,Gospel City Now,,no
UCdypuOVJoXFppJYRjbD7U9Q,Boynton Beach City Library,The Boynton Beach City Library enriches lives by inspiring learning and nurturing creativity.,yes
UCHxHJQCYf067_qYAmq9lKcw,City of Boynton Beach,,city of boynton beach - yes
UCNEaO45xvNW2koM3D_xs28g,BBPCMC,,"sorry, i need the description of the channel to determine if it is an official town or city youtube channel."
UCu_oA1jxD2r9db8ME61eLEQ,Gospel City Now,,no
UCdypuOVJoXFppJYRjbD7U9Q,Boynton Beach City Library,The Boynton Beach City Library enriches lives by inspiring learning and nurturing creativity.,yes
UCyV61p9x_BP3LGcDtrxk6Tg,Boynton Arts,Art and Public Art in the City of Boynton Beach including The Kinetic Biennial.,yes
