channel_id,channel_title,channel_description,is_official
UChQtoWHA7rrqjUPhx_jpfqQ,Brevard Drone,"We are Brevard Drone. Home to epic and honest aerial visuals. If a picture is worth a thousand words, then video is worth a million ...",no
UC4oGgcPUK_0d1VYRfEV9zdA,Janice Ortner,,no
UC-SrCCzkGq0wmSAuRs7EBFg,Miniminuteman,"Archaeologist, Environmental Scientist, Author, Conspiracy Debunker.",no
UChG8traLAtF9OJRhYohkbdg,Oldworlddesign,MillworK | Custom Doors | Moulding Wood | Cabinets | Cabinetry | Handcrafted | Trim | Crown | Old Unique Doors | Interior Country ...,no
UCG4LeEUmw9WoNSlzTkW3a4A,Bad Drivers Of Brevard,"After doing a lot of driving around The great County of Brevard County, Florida. I have seen a lot of Bad Drivers. So, I grabbed a ...",no
UC-SrCCzkGq0wmSAuRs7EBFg,Miniminuteman,"Archaeologist, Environmental Scientist, Author, Conspiracy Debunker.",no
UChG8traLAtF9OJRhYohkbdg,Oldworlddesign,MillworK | Custom Doors | Moulding Wood | Cabinets | Cabinetry | Handcrafted | Trim | Crown | Old Unique Doors | Interior Country ...,no
UCG4LeEUmw9WoNSlzTkW3a4A,Bad Drivers Of Brevard,"After doing a lot of driving around The great County of Brevard County, Florida. I have seen a lot of Bad Drivers. So, I grabbed a ...",no
UCEQ04PjDnhmq9sGLHc7Qt7Q,Vatland Chrysler Dodge Jeep Ram,"Serving all of your Chrysler Dodge Jeep Ram needs in Vero Beach, Sebastian, Winter Beach, Micco, Fellsmere, Gifford, Wabasso, ...",no
