channel_id,channel_title,channel_description,is_official
UCkT_OrXhYOTbsoYxitdHhCA,Palm Harbor,Palm Harbor Homes builds and sells one of the nation's best selling brands of manufactured homes and modular homes.,yes
UCuhzgcEm6KSnOyGjXlwXQlw,Annette L Palm Harbor,,no
UCztHD2BXMbQEKxaLQfdZDOg,LIVING IN PALM COAST FLORIDA,"HABLO ESPANOL Y INGLES!! Are you wondering what it is like to live in Palm Coast Florida? Well, this is the channel you need!",no
UCWeZ4L65qnABsB0hjJUCCzA,Joe Carducci Florida Real Estate,,no
UCGkFIxi0oJ70F1I6ZMHVcbw,Grain and Berry Palm Harbor,Grain and Berry in Palm Harbor is taking the city by storm with our New Acai Fruit Bowls & Organic Smoothies.,no
UCkT_OrXhYOTbsoYxitdHhCA,Palm Harbor,Palm Harbor Homes builds and sells one of the nation's best selling brands of manufactured homes and modular homes.,no
UCGkFIxi0oJ70F1I6ZMHVcbw,Grain and Berry Palm Harbor,Grain and Berry in Palm Harbor is taking the city by storm with our New Acai Fruit Bowls & Organic Smoothies.,no
UCztHD2BXMbQEKxaLQfdZDOg,LIVING IN PALM COAST FLORIDA,"HABLO ESPANOL Y INGLES!! Are you wondering what it is like to live in Palm Coast Florida? Well, this is the channel you need!",no
UCsreVWP5Hlh3t8XospPlkcQ,jrod7716,,no
UCHce5AdxjOPcw2mvtjNWvlg,Welcome Home Tours,"Welcome Home Tours brings you the tours of manufactured, modular, tiny, RV homes and more! Subscribe and enjoy our home ...",no
