channel_id,channel_title,channel_description,is_official
UC-MU3FKsR9fhkL7qhz7Z7aw,Aureous Minerals,Aureous Minerals is dedicated to the collection and preservation of fine mineral specimens. It is operated by former geology and ...,no
UC9Fjo83quvBysloDf8_r38Q,Life's An Adventure,Two lifelong friends just enjoying life and the adventures it brings for us.,no
UCftc-agupvFlfWhuWhYSI5Q,Dytch,We are a four man band out of North Central Florida in a small town called Palatka. Thank you for checking out our channel. Also ...,no
UCHvULMudZ0DWf5Qf15ZuSqQ,Drone Over Florida,,no
UCbp5OIuDhhUVOdpWxUT_0OQ,Carolina Mendez Real Estate Agent in Florida,"I am Carolina Mendez, Your Real Estate Agent in Florida. I sell homes in Broward County in South East Florida: Weston, Davie, ...",no
UC2nvAiUrC7PjvcEuMSeo2WA,"Florida Global International Realty, LLC",,no
UCyrdYl-jZHh-v44C9ynkTOA,Storm Chaser - Follow the Storm,Lets @followthestorm together. Based in Florida and travelling beyond during larger storm events we will cover large ...,no
UC-O5nsJXFwoasxf_6tmclDw,Weichert Realtors Michael Skovron PA,"This Real Estate Agent is a British Realtor®. Born in London, England & moved to Florida in 2001. He also has an Accounting ...",no
