channel_id,channel_title,channel_description,is_official
UCRvsc71rjgODkV1NTPnzQKQ,FloridaSmallTowns,I travel to small towns around Florida that have a lot of history.,no
UCTfKgsXQotPDTJmK922PKrA,Chris Mcintosh,"I love taking pictures, I'm coming by your town to take pictures of the Beauty that's in your city, send me some of your histories in ...",no
UCpfGyu8Bk23HXWULXO5RvqA,Top Rig Fishing,Top Rig Fishing offers fishing tips and advice to amateur fishing enthusiasts. We review products and provide suggestions on the ...,no
UCHDe-ToAAZb7uteOZaU6kzA,Dawna Cantway,"In her life and work, Dawna strives to treat every person with respect and conducts herself with integrity. Previous customers ...",no
UCWhc7Xar2-uCsYc-GAOEBQQ,Fort Morris Historic Site,"When the Continental Congress convened in 1776, the delegates recognized the importance of a fort to protect their growing ...",yes
UCTfKgsXQotPDTJmK922PKrA,Chris Mcintosh,"I love taking pictures, I'm coming by your town to take pictures of the Beauty that's in your city, send me some of your histories in ...",no
UChw4F_6oMmWqAGRpdaVJjyw,Approved 2 Move ,If you are seeking experienced realtors familiar with the Central Florida region and require assistance in connecting with a ...,no
UCsmldXFKYLXQuE9uO6kRcAg,Hubert McIntosh,"Taxes are your single biggest expense. We're here to help business owners like you stop overpaying taxes – legally, ethically, ...",no
UCiMKTAeHv5h8exy7OAvkOGA,Kayden McIntosh 2026 Lacrosse,,no
UCpfGyu8Bk23HXWULXO5RvqA,Top Rig Fishing,Top Rig Fishing offers fishing tips and advice to amateur fishing enthusiasts. We review products and provide suggestions on the ...,no
