channel_id,channel_title,channel_description,is_official
UCksxw7pBAOeOByJjAhSl8jg,Compass Realty of North Florida,"Compass Realty of North Florida specializes in marketing coastal homes, condominiums, and waterfront properties along ...",no
UCblKjOc1PUslDPTQhcU_wuA,Southern Leisure,"Southern Leisure RV Resort is a top-rated adult ACTIVE 55 + RESORT, gated campground/resort community in the beautiful ...",no
UC9MNwMuigm3PeKHacwz2xQQ,City of Newberry,Official YouTube channel for the City of Newberry. Includes commission meetings and other municipal government meetings.,yes
UCksxw7pBAOeOByJjAhSl8jg,Compass Realty of North Florida,"Compass Realty of North Florida specializes in marketing coastal homes, condominiums, and waterfront properties along ...",no
UCyjAQEHRfA0G-bfZ00nafhQ,The Orange and Blue City,Bronson (Florida) Eagles Middle/ Highschool sports video clips and photos.,no
UC4fmgtBeOfpmNL4JhwL2IAw,Siemens Traffic Signals and Road Signals,Welcome to Traffic Light Of Siemens From Smartrip Guy 118 Productions YouTube Channel.,no
UCX4a3hGClnxlCxaiVsAjeQQ,Chris Clark,"A collection of short clips revolving around fishing, snorkeling, rock climbing and how-to's.",no
UCFEARR_9_MUmPih-N47AeEg,ARTTHUGO,Welcome to Artthugo by Hugo Alvarado. In my Channel you can see things you never seen. My creations cover multiple subject in ...,no
