channel_id,channel_title,channel_description,is_official
UCak1_v7UFM8nqIviX53nzaA,"City of Crescent City, Florida","Crescent City, FL is located between Two bodies of water, Crescent Lake lies to the east of the town and Lake Stella lies to the ...",yes
UCdWwIMAj0Jnra1567A4Ipeg,Auto Pedigree,"Auto Pedigree houses the largest second hand, quality used car vehicle stock pool in the country. All our quality used cars are ...",no
UCak1_v7UFM8nqIviX53nzaA,"City of Crescent City, Florida","Crescent City, FL is located between Two bodies of water, Crescent Lake lies to the east of the town and Lake Stella lies to the ...",yes
UCQ9Nwz2KysijaEquGX1n1Gw,"Champion Realty of Florida, LLC",A Real Estate company helping sellers and buyers in the North/Central Florida area.,no
UCHvULMudZ0DWf5Qf15ZuSqQ,Drone Over Florida,,no
UCO7erx7vSzH4Ogp9Mrka5lw,GoingOrganic1,Exploration in going organic.,no
UCmWcCWWqusxI8-Hx6PgLhLQ,Terry Tennant,Hopeful making a difference in the world and spreading truth this is all that matters.,no
