channel_id,channel_title,channel_description,is_official
UCdhpRs4ukUSvB8eGSKn1fYQ,Town of Pierson,"Town of Pierson, Florida.",yes
UCY8SLLJjWpS4sx1dEqECaIw,Tyler Oliveira,filmed on an iPhone. Help me pass 100 subs! For other brand opportunities / if you want to get in contact with me: ...,no
UC_1k0uMN3AM4Ny7GP8j0jxA,Amp Celebs,Amp is the squad forever get me 1k subscribers plz.,no
UC8RbgxtYaViMHEKmcpsmi6w,The Allman Brothers Band - Topic,,no
UC5UlTiDwIzCCU0O_qsonQdw,Florida Real Estate Pros,"The Florida Real Estate Pros YouTube Channel was created with the goal of showing visitors coverage of local events, fun places ...",no
UCY8SLLJjWpS4sx1dEqECaIw,Tyler Oliveira,filmed on an iPhone. Help me pass 100 subs! For other brand opportunities / if you want to get in contact with me: ...,no
UCNlNiwEJM9VLoXq7Q42Y3Sg,Fruitland Peninsula Historical Society,"The Fruitland Peninsula Historical Society, based in Crescent City, Florida, was founded in 2010 to preserve and share the history ...",yes
UCu_uvnzByv3enD6ucbIoWYw,"Robert Greene, Deland's Realtor","Robert Greene, Realtor, has been working for over 39 years in West Volusia County, Florida. If you are interested in buying or ...",no
UC32701TlD6tKVMmIjKmY0UA,elcompa grande music,Musica de tierra caliente..,no
