channel_id,channel_title,channel_description,is_official
UCB7E094GNsw0d2_an2lHiHQ,Village of Estero,"Videos from the Village of Estero, Florida. www.estero-fl.gov.",yes
UC8jhLDCy6ybuOnvXjt8SNLg,LeeCorp Homes Estero Model Center,"As Florida's largest manufactured housing dealer and #1 dealer of Jacobsen Homes throughout Southwest Florida, LeeCorp ...",no
UCHfQbxlQVCOMMul8N0B1fTg,VisualPRO Photography,"VisualPRO Photography offers Professional Real Estate Photography and Videography in Cape Coral, Fort Myers, Naples, Estero ...",no
UCHNuO7H77iweImpU4vTVpdA,Living in Southwest Florida,Are you wondering what it's like to live in Southwest Florida? Maybe you're thing about moving or relocating to the area?,no
UCGty-Uv-zigm2ybJermtr8g,Living In Southwest Florida,"If you are thinking about moving to Southwest, Florida then this is the Channel you need! We tell you what it is like to move to ...",no
UC47Nme86YGrVy1lY15rF3ig,Thrive Community Church,"Thrive is more than just a meeting to attend. It's a diverse, spiritually growing family to be a part of, centered on the person and ...",no
